headword,pos,supplement,entry,meaning,ipa,word_id,example_sentence,translated_sentence,sentence_id
,,,worthwhile,価値のある / やりがいのある,/wɜrθˈwaɪl/,47902,Visiting the Louvre Museum is a worthwhile experience.,ルーブル美術館を訪れることは価値のある経験です。,3006872
,,,conglomerate,固まりになった;密集した  / 礫岩(れきがん)の  / 複合企業の  / (いろいろな物の)集合体;丸いかたまり  / 礫岩  / 複合企業  / …'を'集めて丸く固める  / 丸く固まる,/kənˈɡlɑmərət/,8961,The conglomerate of rocks formed a solid structure.,岩石の塊が強固な構造を形成した。,1658494
,,,devaluation,"貨幣の平価切り下げ,デノミ",/dɪˌvæljuˈeɪʃən/,11665,The devaluation of the currency caused prices to skyrocket.,通貨の切り下げにより物価が急騰した。,1628752
,,,endless,"無限の,果てしのない  / 絶え間のない,ひっきりなしの  / (端と端がつながって)輪になっている",/ˈɛndləs/,13963,The possibilities are endless.,可能性は無限です。,2998137
,,,expertise,"〈U〉専門技術,専門知識 / 〈C〉専門家の調査報告",/ˌɛk.spɝˈtiːz/,14828,He has extensive expertise in the field of technology.,彼はテクノロジーの分野で広範囲の専門知識を持っています。,1628233
,,,handful,"〈C〉《...の》一握り, 一つかみ《of ...》 / 《a ~》《...の》わずか, 少量《of ...》 / 《話》手に負えない人(物事)",/'hænd.fʊl/,19136,He picked up a handful of sand.,彼は砂を一握り拾い上げた。,2999466
,,,reportedly,伝えられるところによれば…とのこと,/rɪˈpɔːrtɪdli/,35679,"Reportedly, the company is planning to launch a new product next month.",伝えられるところによれば、その会社は来月新製品を発売する予定です。,1657689
,,,provoke,...を怒らせる / (ある状態に)(人)を駆り立てる  / (人の反応など)を引き起こす,/prəˈvoʊk/,33826,His controversial remarks provoked a heated discussion among the panelists.,彼の物議を醸す発言は、パネリストたちの間で熱い議論を引き起こした。,6535959
,,,quasi,"【複合要素】疑似の..., 類似の..., ある意味の..., 準...",/'kweɪzɪ/,34365,He is a quasi-scientist.,彼は疑似科学者です。,1657691
,,,veto,"【名】拒否権；拒否権の行使；拒否；禁止【動/他】を拒否する,否認する",/'vitoʊ/,46125,The president has the power to veto any bill passed by Congress.,大統領は議会が可決した法案を拒否する権限を持っています。,1634893
,,,void,"(法的に)無効な  / 《文》空虚な,からっぽの  / 《補語にのみ用いて》《be void of+名》(…が)ない,欠けた  / 〈U〉《the ~》(地球の回りの)空間,空所,虚空  / 〈C〉《単数形で》(地面・壁などの)すきま,割れ目  / 〈C〉《単数形で》空虚感,物足りなさ  / (法的に)…‘を'無効にする  / …‘を'からにする;…‘を'排泄(はいせつ)する",/vɔɪd/,46422,The contract was declared void by the court.,契約は裁判所によって無効とされました。,3006494
,,,wholesaler,卸し売り業者,/ˈhoʊlˌseɪlər/,47378,The wholesaler supplies products to retailers.,卸し売り業者は小売業者に商品を供給します。,3006719
,,,unprecedented,"【形】先例のない,未曾有の；史上最大の,空前の",/ʌnˈprɛsɪˌdɛntɪd/,45358,The COVID-19 pandemic has caused unprecedented challenges for the global economy.,新型コロナウイルスのパンデミックは、世界経済にとって先例のない挑戦を引き起こしました。,3006241
,,,unwilling,気が進まない、不本意の,/ʌnˈwɪlɪŋ/,45533,She was unwilling to go to the party.,彼女はパーティーに行く気が進まなかった。,3006276
,,,wary,警戒している、注意深い、用心深い,/'wɛri/,46724,I am wary of strangers.,私は見知らぬ人に警戒しています。,3006561
,,,wholly,"まったく,完全に(completely)",/ˈhoʊ.li/,47381,She is wholly committed to her work.,彼女は仕事に完全に取り組んでいます。,6510514
,,,yuan,"ユアン,元(中華人民共和国の貨幣単位)",/juːˈɑːn/,48188,The currency of China is yuan.,中国の通貨はユアンです。,3006957
,,,allocate,"《...に》...を配分する, を割り当てる《to, for ...》",/ˈæləˌkeɪt/,1150,The company will allocate resources to the new project.,会社は新しいプロジェクトにリソースを割り当てます。,1628112
,,,probe,探査器 / 探求 / 問題点 / 探測器 / 調査,/prəʊb/,33472,Scientists launched a probe to explore the outer reaches of the solar system.,科学者たちは、太陽系の外部領域を探査するために探査機を打ち上げました。,3003173
,,,subtract,"《...から》 ...を引く, を減じる 《from ...》 / 引き算をする",/səbˈtrækt/,41585,"To solve this math problem, you need to subtract the second number from the first number.",この数学の問題を解くには、2番目の数を1番目の数から引く必要があります,3005247
,,,contemplate,"をよく考える,を熟考する / をじっと見つめる / を予想する / 熟考する",/kɒnˈtɛm.pleɪt/,9178,I contemplate my future every day.,私は毎日将来をよく考えます。,3009841
,,,pledge,"【名/C/U】誓約, 固い約束 / 【名/U】担保, 抵当 / 【動/他】を誓約する, を固く約束する / に誓約させる / を担保に入れる",/ plɛdʒ /,32255,I pledge to always be there for you.,いつもあなたのそばにいることを誓います。,3002861
,,,ledger,"〈C〉元帳, 原簿, 台帳",/ˈlɛdʒər/,24165,I need to update the ledger with the latest transactions.,最新の取引で元帳を更新する必要があります。,3000795
,,,advisory,"勧告の,忠告の;諮問の",/ədˈvaɪzəri/,646,The government issued an advisory to the public regarding the upcoming storm.,政府は、近日予想される嵐に関して一般市民に勧告を出しました。,1634074
,,,customize,…'を'注文どおりに作る,/ˈkʌstəˌmaɪz/,10494,You can customize your order to your liking.,あなたは注文どおりに作ることができます。,1640230
,,,formulation,"〈U〉公式化,  定式化, 制定 / 《薬学》製法, 処方, 製剤 / 〈C〉明確な表現",/fɔːrˌmjʊˈleɪʃən/,16668,The formulation of the new policy took several months.,新しい政策の策定には数ヶ月かかりました。,1629016
,,,likelihood,"【名/U】《...が》ありそうなこと / 《...の》見込み,可能性ある《of》",/lɑɪklihʊd/,24523,There is a high likelihood of rain tomorrow.,明日は雨の可能性が高いです。,3000875
,,,harsh,"【形】(感触や目・耳など五感に)不快な / 厳しい, 過酷な / 【動/自】《くだけて》《...のことを》ひどくけなす《for ...》",/hɑːrʃ/,19320,The harsh winter wind cut through my coat.,厳しい冬の風が私のコートを貫いた。,2999527
,,,locally,"【副】地方的に, 局部的に / 地元で, 近くで",/ləʊkəli/,24859,I love to support locally owned businesses.,地元の経営者が運営するビジネスを応援するのが好きです。,1653512
,,,mandate,"【名/C】命令, 指令 / 委任, 権限付与 / 【名/U】委任統治 / 【動/他】(領土・植民地など) の統治を委任する",/mændeɪt/,25720,The government decided to issue a mandate requiring all citizens to wear face masks in public places during the pandemic.,政府は、パンデミック時に公共の場ですべての国民にフェイスマスクの着用を義務付けることを決定した。,1627598
,,,underwrite,...の費用負担を承諾する / (文書など)に署名する / (株式・債券など)を引き受ける,/ʌndərˈraɪt/,45069,The bank underwrote the loan.,銀行はローンを担保した。,1625428
,,,disposition,"〈U/C〉人の)気質,性質 / 〈C〉(…する)傾向,(…したい)気持ち / 〈U〉配置,配列([[arrangement]]) / 〈U〉(物事の最終的な)処理,処置, 決着 / 〈U〉(物件などの)処分,譲渡,売却; 使用権,自由裁量権",/dɪsˌpəˈzɪʃən/,12300,Her cheerful disposition always brightens up the room.,彼女の陽気な性格はいつも部屋を明るくします。,2997711
,,,lifetime,"〈C〉生涯, 一生",/ˈlaɪfˌtaɪm/,24466,The memories we create last a lifetime.,私たちが作り出す思い出は一生続く。,3000854
,,,rigid,"【形】固い, 厳格な/硬い,柔軟性のない",/ˈrɪdʒɪd/,36189,The metal rod is rigid and cannot be bent.,金属の棒は固くて曲げることができません。,3003887
,,,sensitivity,"敏感,(生理的な)感受性  / 感度,度光度",/sɛnˈsɪtɪvəti/,38107,She has a high sensitivity to noise.,彼女は騒音に対して高い敏感さを持っています。,3004346
,,,takeover,"(管理・支配などの)奮取,接収;(特に会社などの)乗っ取り",/ˈteɪkˌoʊvər/,42410,The company announced a takeover of its competitor.,同社は競合他社の買収を発表した。,1648338
,,,deliberate,"故意に, 慎重な / よく考えた, 意図的な",/dɪˈlɪbərət/,11227,He made a deliberate decision to quit his job.,彼は故意に仕事を辞める決断をした。,2997419
,,,adverse,"反対の,逆の,敵意を持つ  / 逆方向の / 有害な",/ædˈvɜːrs/,628,He experienced an adverse reaction to the medicine.,彼はその薬に対して副作用を経験しました。,1627167
,,,discriminate,〈自〉《...に対して》 差別待遇する 《against ...》 / 《...間の》 差異を見分ける《between ...》 〈他〉AとBを見分ける《A from B》 / 区別する，弁別する,/dɪˈskrɪmɪneɪt/,12129,It is important to treat everyone equally and not discriminate based on their race or gender.,人種や性別に基づいて差別することなく、みんなを平等に扱うことが重要です。,2997667
,,,inspection,"調査, 検査",/ɪnˈspɛkʃən/,22076,The inspection of the building revealed several safety violations.,建物の調査でいくつかの安全違反が明らかになりました。,3000257
,,,repertoire,"上演目録,演奏曲目,レパートリー",/rɛpərˈtwɑr/,35653,She has a wide repertoire of songs.,彼女は幅広い曲目のレパートリーを持っています。,1645950
,,,exert,"《...に》(威力など)を発揮する 《on ...》 / 《...に》 (感化など) を及ぼす 《on ...》 / 使う, 行使する",/ɪɡˈzɜːrt/,14732,She exerted all her energy to finish the race.,彼女はレースを終えるために全力を尽くした。,1628302
,,,interfere,"《...に》干渉する《in, with ...》 / 《仕事・状況などの》 妨げとなる《with ...》/ 妨害する, 邪魔する",/ˌɪn.tərˈfɪər/,22246,I don't want to interfere in their personal matters.,私は彼らの個人的な問題に干渉したくない。,3000311
,,,vulnerable,"傷つきやすい, もろい, 弱い, 脆弱な / 攻撃を受けやすい、かかりやすい",/ˈvʌlnərəbəl/,46499,She is a vulnerable person.,彼女は傷つきやすい人です。,3006512
,,,defect,"【名】障害, 欠点, 欠乏, 欠陥",/dɪˈfɛkt/,11111,There is a defect in the product.,製品に欠陥があります。,2997390
,,,render,"《render+名〈目〉+形〈補〉》…‘を'(…の状態に)する)make)  / …‘を'行う,果たす  / (…に対して)…‘を'返す《+名+for+名》  / '‘を'公式に宣言する,言い渡す  / (…に)〈計算書など〉‘を'提出する,送付する《+名+to+名》  / (文章や絵画で)…‘を'表現する  / (…に)…‘を'翻訳する(translate)《+名+into+名》  / ‘を'演奏する,演ずる(perform)  / 〈脂肪など〉‘を'溶かす,溶かして精製する《+名+down,+down+名》",/ˈrɛndər/,35592,The artist used vibrant colors to render the scene more realistic.,芸術家は鮮やかな色を使って、シーンをよりリアルに描写しました。,3003717
,,,secular,"世俗的な,現世の, 宗教に関係のない / (聖職者が)修道院に住まない,修道会に所属しない",/'sɛkjʊlər/,37826,He has a secular view of life.,彼は人生に対して世俗的な見方を持っている。,1628888
,,,denote,を示す / を意味する / の記号である,/dɪˈnoʊt/,11378,The red color denotes danger.,赤色は危険を示す。,2997454
,,,impact,"〈U〉〈C〉(…の…に対する)衝突,衝撃《+of+名+against(on,upon,with)+名》  / 〈C〉(…の…に対する)影響(influence)影響力《+of+名+on(upon, against)+名》 / 他動 / 〔～に〕影響を与える［及ぼす］ / 〔～を〕詰め込む / 〔～に〕激突する / 自動 / 影響を与える［及ぼす］ / 激突する",/ˈɪmpækt/,21137,The earthquake had a significant impact on the city.,地震は市に大きな衝撃を与えました。,3000009
,,,query,"〈C〉質問, 疑問 / 疑問符",/'kwɪəri/,34391,I have a query about the new product.,新製品についての質問があります。,3003338
,,,plague,"〈C〉〈U〉(死亡率の高い) 疾病 / 《the ~》ペスト / 《...の》災い, 災難《of ...》 / 《話》やっかいな人, 悩みの種 / 〈他〉《...で》を悩ます《with ...》",/pleɪɡ/,32106,"The plague swept through the city, causing widespread panic.",ペストが市内に広がり、広範なパニックを引き起こしました。,3002827
,,,explicitly,"【副】明示的に；明白に,はっきりと,あからさまに.",/ɪkˈsplɪsɪtli/,48303,She explicitly stated her opinion during the meeting.,彼女は会議中に明示的に自分の意見を述べました。,1638368
,,,projection,"〈C〉見積もり, 予測 / 〈U〉〈C〉突き出ること, 突起 /  投影すること, 投影図 / 〈U〉発射 / 発声",/prəˈdʒɛkʃən/,33586,The projection on the wall was clear and vivid.,壁に映し出された投影ははっきりと鮮明でした。,1628487
,,,chancellor,"〈C〉(西独・オーストリアなどの)首相  /  (アメリカのいくつかの大学で)総長,学長 / 各種の高官の称号",/ˈtʃænsələr/,7008,The chancellor is responsible for leading the government.,首相は政府を指導する責任があります。,3009332
,,,script,"〈U〉手書き, 筆記体 / 筆記活字 / 〈U〉〈C〉(ある言語の)文字, (alphabetなどの)文字体系 / 〈C〉台本, 脚本",/skrɪpt/,37590,The actor memorized the script for the play.,俳優は演劇の台本を暗記しました。,3004183
,,,elaborate,【動詞】詳しく説明する、ものを精巧に作る 【形容詞】精巧な、入念な,/ɪˈlæbəreɪt/,13571,Could you please elaborate on your idea?,あなたのアイデアについて詳しく説明していただけますか？,2998055
,,,vague,"(言葉・意味などが)はっきりしない,あいまいな  / (考え・感じなどが)ばく然としている,ぼんやりした  / (形・姿などが)ぼやけた,はっきりしない  / 《名詞の前にのみ用いて》《通例最上級で》《話》ほんのわずかの,かすかな",/veɪɡ/,45782,Her explanation was vague and unclear.,彼女の説明は曖昧で分かりにくかった。,3006347
,,,concede,"（譲歩して）...を真実と認める《that ...》 ；《A（権利など》を《B（人）》に与える《A to B》《B A》  / 《...に》譲歩する《to ...》/ 敗北を認める,（しぶしぶ）認める",/kənˈsiːd/,8769,He finally conceded defeat and congratulated his opponent.,彼はついに敗北を認め、相手を祝福した。,3009741
,,,interact,"《...と》相互に作用する, 影響し合う, 交流する《with ...》",/ɪntərˈækt/,22209,I love to interact with people from different cultures.,私は異なる文化の人々と交流するのが好きです。,1640104
,,,empirical,"経験的な, 経験を基礎とする / 実証的な, 実験に基づいた",/ɪmˈpɪrɪkəl/,13854,,,
,,,qualitative,"(量でなく)質的な,性質上の,質にかかわる,定性的な",/kwɒlɪˈteɪtɪv/,34325,The researcher conducted a qualitative study to gather in-depth information.,研究者は詳細な情報を集めるために質的な研究を行った。,1628562
,,,retrieve,"【動/他】《...から》を取り戻す, を回収する《from ...》 / 〈罪など〉を償う,〈誤りなど〉を訂正する / 〈猟犬が〉〈獲物〉を捜して持って来る",/rɪˈtriːv/,35931,The police managed to retrieve the stolen goods.,警察は盗まれた商品を取り戻すことに成功しました。,1665364
,,,entail,"…を必然的に伴う / 《…に》〈損失・労力・出費など〉を負わせる, を課する《on, for ...》 / 《…に》〈土地〉を限嗣相続させる《on, upon ...》",/ɪnˈteɪl/,14096,The decision to move to a new city entails leaving behind friends and family.,新しい街に引っ越すという決断は、友人や家族を必然的に置き去りにすることを伴います。,2998181
,,,forge,"【動/自】ぐんぐん前に出る,どんどん進む、【動/他】〔金属を〕鍛造する、プレスする",/fɔːrdʒ/,16616,He used a hammer to forge the metal into a sword.,彼は金属を剣に鍛えるためにハンマーを使った。,1658917
,,,terror,"〈U/C〉(身に迫る) 恐怖 / 〈C〉恐ろしい人(物・事) / 《話》やっかいな人,手に負えない物 / 〈U〉テロ",/'tɛrər/,42911,The terror of the unknown kept her awake at night.,未知の恐怖が彼女を夜眠れなくさせた。,3005616
,,,successor,"【名/C】《...の》後任者, 継承者, 相続人《to ...》 / 《...に》取って代わる者《to ...》",/səkˈsɛsər/,41607,He is the successor to the company.,彼はその会社の後継者です。,1654185
,,,bundle,"【名/C】《…の》束, 包み《of ...》 / 【動/他】を包みにする, を束にする",/'bʌndəl/,5576,I bought a bundle of flowers for my mother's birthday.,私は母の誕生日に花束を買いました。,3009107
,,,deploy,"【動/他】を配置する, を配備する / を活用する / を作動する / 【動/自】(部隊などが)配置につく / 作動する",/dɪˈplɔɪ/,11439,We need to deploy the new software update.,新しいソフトウェアのアップデートを展開する必要があります。,1651131
,,,intervene,"《...に》干渉する,介入する《in ...》 / 《...の間を》 仲裁に入る《between》 / じゃまに入る / 間に起こる《between》  / ...と言って口をはさむ",/ˌɪntərˈviːn/,22363,The teacher decided to intervene in the argument between the students.,先生は生徒たちの口論に干渉することを決めた。,3000331
,,,contingency,"〈C〉不測の事態, 偶発事件,不慮の事故 / 〈U〉偶然, 偶発性,随伴性",/kənˈtɪndʒənsi/,9213,"In case of an unforeseen contingency, the company has a well-prepared emergency plan to ensure everyone's safety.",不測の事態が発生した場合、全員の安全を確保するために、万全の緊急対策が用意されています。,1627348
,,,repay,を返す / 《...に対して》〈人〉に報いる《for ...》  / 〈行為〉にお返しをする,/ˌriːˈpeɪ/,35639,I need to repay my loan by the end of the month.,私は月末までにローンを返さなければなりません。,3003737
,,,technically,"専門的に / 技術的に / 厳密に言えば / 表向きは, 表面上は, 建前としては",/tɛkˈnɪkəli/,42688,"Technically, I am not allowed to disclose that information.",厳密に言うと、その情報を開示することは許されていません。,3005550
,,,surplus,"【名/U/C】余剰,余分【名/C】余剰金,黒字【形】余分な,余剰の",/sərˈplʌs/,41961,The company had a surplus of funds at the end of the year.,会社は年末に資金の余剰を持っていました。,3005354
,,,clarify,"〈他〉を明らかにする, を理解しやすくする / 〈液体・空気など〉を澄ませる / 〈自〉〈思想・意味などが〉分かりやすくなる / 澄む",/ˈklærəˌfaɪ/,7755,Could you please clarify your question?,質問を明確にしていただけますか？,3009516
,,,dividend,"〈C〉配当, 配当金 / 《数》 被除数",/ˈdɪvɪdɛnd/,12457,The company announced a dividend increase for its shareholders.,会社は株主のために配当の増加を発表しました。,1628489
,,,steer,"〈他〉(船・車・飛行機など) のかじをとる, を操縦する / (人)を操る / (進路・道)を操縦して進む  / を導く, に道を教える / 〈自〉操縦する / 進路を取る / かじがきく",/stɪr/,40899,He tried to steer the conversation away from controversial topics.,彼は議論の的となる話題から会話をそらそうとした。,3005087
,,,coordinate,"（各部分）を調和させる, を調整する  / 《...と》調和して動く《with ...》",/koʊˈɔrdɪneɪt/,9384,I need you to coordinate with the other team members and ensure we complete the project [[on time]].,他のチームメンバーとの調整を行い、時間内にプロジェクトを完了させてほしい。,1625356
,,,patent,【名/C】特許 / 専売特許品 / 【形】専売特許の / 独特な / 明白な / 【動/他】の特許を取る / に特許を与える,/'peɪtnt/,30852,He filed a patent for his invention.,彼は彼の発明の特許を申請しました。,3002546
,,,assemble,"(ある目的で)〈人・物〉'を'集める,集合させる  / (部品を集めて)〈機械など〉'を'組み立てる  / …'を'整とんする,きちんと並べる  / (人が)集まる,会合する(meet)",/əˈsɛmbəl/,2385,We need to assemble a team of experts for this project.,このプロジェクトのために、専門家のチームを集める必要があります。,2996286
,,,persistent,"(反対・困難にもくじけず)あくまでもやり抜く,ねばり強い,執ような  / いつまでも続く,持続する(lasting)",/pɚˈsɪstənt/,31421,She was persistent in pursuing her dreams.,彼女は夢を追い求めることにあくまでもやり抜いた。,3002645
,,,explode,"〈自〉爆発する / 《怒り・笑いなどで》〈人が〉爆発する《with, in ...》 / 〈人口などが〉急激に増す / 〈他〉〈物〉を破裂させる / 〈習慣・迷信・学説など〉をくつがえす",/ɪkˈspləʊd/,14845,The fireworks exploded in the night sky.,花火が夜空で爆発した。,2998374
,,,entrepreneur,〈C〉起業家 / 興行主,/ˌɑn.trə.prəˈnɝ/,14148,She is a successful entrepreneur.,彼女は成功した起業家です。,2998194
,,,spy,〈C〉スパイ / 探偵,/spaɪ/,40536,The spy was caught in the act of espionage.,そのスパイはスパイ活動中に捕まった。,1623815
,,,dose,〈C〉(おもに飲み薬1回分の) 服用量 / (痛いこと・いやなことの)1回分,/dəʊs/,12696,The doctor prescribed a dose of medication for the patient.,医師は患者に薬の服用量を処方しました。,2997820
,,,arguably,"まず間違いなく,十分論証できることだが / 議論の余地はあるかもしれないが / きっと, おそらく",/ˈɑːrɡjʊəbli/,48393,He is arguably the best player in the world.,彼はまず間違いなく世界で最も優れた選手だ。,1649928
,,,plausible,(話などが)もっともらしい / 口先のうまい / 見込みのある/妥当な,/ˈplɔːzəbəl/,32203,His explanation sounded plausible.,彼の説明はもっともらしかった。,3002844
,,,hostile,"【形】敵の / 敵意のある, 敵対する / 不利な / 【名/C】敵意のある人, 敵兵",/'hɒstaɪl/,20434,The two countries have been in a hostile relationship for decades.,二つの国は何十年も敵対的な関係にある。,2999831
,,,debit,〈C〉(銀行口座の) 引き落とし / (簿記で)借り方,/'dɛbɪt/,10921,The accountant calculated the company's credits and debits.,会計士はその会社の貸方と借方を計算しました。,3020297
,,,defy,"〈他〉《...してみようとAに》挑む, 挑発する,挑戦する《~ A to do》 / 〈他〉 を無視する,をものともしない /  〈他〉を拒む,を受け付けない,拒否する / 〈他〉逆らう,従わない",/dɪˈfaɪ/,11175,They defied the policeman's order.,彼らは警官の命令に従わなかった。,23694
,,,discretion,"分別,慎重さ(prudence)  / (行動・選択などの)判断の自由;自由裁量",/dɪˈskrɛʃən/,12127,Please use your discretion when sharing personal information.,個人情報を共有する際は、ご自身の判断で行ってください。,2997665
,,,prosecute,"《...の罪で》〈人〉を起訴する, を告訴する, 摘発する《for ...》 / (司法手続きに訴えて)〈権利など〉を要求する /   〈調査・事業など〉をやり通す,を遂行する",/prəˈsɛkjuːt/,33731,The district attorney agreed to prosecute the suspect for embezzlement.,地方検事は、容疑者を横領で起訴することに同意した。,1627060
,,,migration,"〈U〉〈C〉移住,(動物の)移動  / 〈C〉《集合的に》(人・動物などの)移動の群",/mɪˈɡreɪʃən/,26781,Migration is a natural phenomenon that has been happening for centuries.,移住は何世紀も前から起こっている自然現象です。,3001451
,,,reinforce,"を増強する,を補強する / に増援する,に援兵を送る",/rɪnˈfɔːrs/,35450,Regular exercise can help reinforce your immune system.,定期的な運動は免疫システムを増強するのに役立ちます。,3003660
