headword,pos,supplement,entry,meaning,ipa,word_id,example_sentence,translated_sentence,sentence_id
,,,proprietorship,【名/U】所有権；個人事業,/prəˈpraɪətərʃɪp/,48436,He decided to start his own proprietorship.,彼は独自の個人事業を始めることを決めた。,1660193
,,,coincide,"〈自〉《Aと》同時に起こる《with A》；《Aと》一致する,ぴったり合う《with,in A》",/kəʊɪnˈsaɪd/,8238,"Our schedules coincide, so we can meet up for lunch.",私たちのスケジュールが重なるので、昼食を一緒に取ることができます。,3009604
,,,convey,"《...に》を伝達する,伝える；を運ぶ,運搬する；を正式に譲渡する《to》",/kənˈveɪ/,9324,I need to convey an important message to him.,彼に重要なメッセージを伝える必要があります。,3009877
,,,devise,"【動/他】を工夫する,を考案する；を遺贈する【動/自】計画の立案をする,考案する; 工夫する【名/U】遺贈【名/C】遺贈文言",/dɪˈvaɪz/,11695,She had to devise a plan to escape from the prison.,彼女は刑務所から脱出するための計画を練らなければならなかった。,2997556
,,,divert,"〈他〉〜を迂回させる,（BからCへA）をわきへそらす《A from B to C》 / （BからA）をそらす《A from B》 / を楽しませる",/dɪˈvɜrt/,12451,I had to divert my attention from the TV to answer the phone.,私は、電話に出るためにテレビから注意をそらさなければならなかった。,2997752
,,,modification,"修正,変更した(された)もの  / 〈U〉〈C〉(文法で)修飾",/mɑdɪfɪˈkeɪʃən/,27266,The modification of the building was necessary to meet safety regulations.,建物の修正は安全規制を満たすために必要でした。,1643311
,,,regulatory,"取り締まる(ための), 調節する(ための),調整する(ための)",/rɛɡjəˈleɪtəri/,48456,The government implemented new regulatory measures to control pollution.,政府は新たな規制措置を実施して、汚染を制御しました。,1633428
,,,rebel,"〈C〉反逆者,反抗者",/ˈrɛbəl/,35022,The rebel group launched an attack on the government forces.,反乱グループが政府軍に攻撃を仕掛けた。,3003530
,,,rein,"【名/C】手綱；制御手段；制御,統率【動/他】を御する；を抑制する",/ɹeɪn/,35446,Santa Claus uses rein deer to pull his sleigh.,サンタクロースはトナカイを使ってソリを引く。,3003661
,,,stockmarket,【名】株式市場 / 証券取引所 / 株式売買 / 株価,/stɑkˌmɑrkɪt/,48447,The stock market is experiencing a downturn.,株式市場は下降傾向にあります。,1633442
,,,modest,"謙虚な,控えめな,遠慮がちな / 品のいい / 地味な,質素な / 中ぐらいの, 並の",/mɑdɪst/,27263,She is known for her modesty.,彼女は謙虚さで知られています。,3001571
,,,cleaner,〈C〉掃除機 / 《The ~s》クリーニング屋（店） / クリーニングする人 / 清掃作業員 / 洗剤,/ˈkliːnər/,7807,I hired a cleaner to help me with the housework.,私は家事を手伝ってもらうために掃除人を雇いました。,3009527
,,,displace,"〈他〉にとって代わる / 《Aから》を強制的に退去させる,移動させる,やめさせる《from A》 / の排水量を持つ",/dɪsˈpleɪs/,12288,The earthquake displaced many people.,地震で多くの人々が避難した。,1626892
,,,momentum,"【名/U/C】運動量 【名/U】勢い,はずみ",/moʊˈmɛntəm/,27342,The team gained momentum after winning the first game.,チームは最初の試合に勝った後、勢いを得ました。,1627985
,,,dynamic,"動力の,動的な；（人・思想などが）精力的な,活力のある",/dɪˈnæmɪk/,13242,The dynamic performance of the car was impressive.,車のダイナミックなパフォーマンスは印象的でした。,2997955
,,,exporter,"〈C〉輸出業者,輸出国",/ɪkˈspɔːrtər/,14861,The exporter shipped the goods to multiple countries.,輸出業者は商品を複数の国に出荷しました。,1628608
,,,profitable,利益の上がる；有益な / 《Aが》...することが儲けになる《It is ~ for A to do》,/ˈprɒfɪtəbəl/,33547,Investing in stocks can be profitable if done wisely.,株式投資は賢く行えば利益を上げることができます。,3003202
,,,synthetic,"【形】合成の；作りものの,人工の；総合の,統合的な【名/C】合成品,人造物",/sɪnˈθɛtɪk/,42282,She wore a synthetic wig to the party.,彼女はパーティーで合成のウィッグをかぶっていた。,3005450
,,,thrive,"【動/自】よく成長する,健康である；成功する,栄える,繁栄する；《Aを》生きがいとする《on A》；《Aで》うまくやる",/θraɪv/,43242,Plants thrive in sunlight and water.,植物は日光と水で成長する。,3005778
,,,widen,"〈他〉を広くする /（目）を見開く〈自〉《...まで》広くなる,広がる《to》 / 《...などで》（目が）見開かれる《in,with》",/ˈwaɪdən/,47429,The road was widened to accommodate more traffic.,道路は交通量を増やすために広げられました。,1650134
,,,absorption,【名/U】吸収；合併；夢中になること,/əbˈsɔːrpʃən/,201,The absorption of nutrients is essential for our body.,栄養素の吸収は私たちの体にとって必要不可欠です。,2995640
,,,accelerate,"…‘の'速度を速める,加速する  / 〈ある状態〉'を'早く起こさせる  / 速くなる,速度を増す",/əkˈsɛləreɪt/,251,The car started to accelerate as it moved down the hill.,車は丘を下り始めると速度を速め始めました。,2995664
,,,acceptance,"〈U〉受け取ること,認めること,受け入れられていること;同意  / 〈U〉(手形の)引受け;〈C〉引受済み手形",/əkˈsɛptəns/,262,Her acceptance of the award was met with applause.,彼女の受賞の受け入れは拍手で迎えられました。,1653221
,,,accessible,"(またget-at-able)近づきやすい,入りやすい,達しうる  / 《補語にのみ用いて》(感情などに)動かされやすい,(…の)影響を受けやすい《+to+名》",/əkˈsɛsəbəl/,269,This airport is easily accessible by bus.,この空港はバスで楽に行けます。,133992
,,,accomplishment,"〈U〉完成,成就(じょうじゅ)  / 〈C〉業績  / 《複数形で》教養,たしなみ,才芸",/əˈkʌmplɪʃmənt/,298,She felt a great sense of accomplishment after completing the marathon.,彼女はマラソンを完走した後、大きな達成感を感じました。,1641811
,,,accordingly,"従って,それだから,それゆえ([[therefore]])  / それに応じて,適宜に",/əˈkɔːrdɪŋli/,303,"The weather was bad, so accordingly, we cancelled our picnic.",天気が悪かったので、従って、私たちはピクニックをキャンセルしました。,2995687
,,,accountable,"説明のつく, 説明できる / （説明する）責任がある",/əˈkaʊntəbəl/,310,"As a team leader, you are accountable for the performance of your team.",チームリーダーとして、あなたはチームのパフォーマンスに対して説明責任があります。,2995696
,,,accumulate,"を蓄積する,ためる / 蓄積する,たまる",/əˈkjumjəˌleɪt/,324,"Over time, he managed to accumulate a vast collection of rare books.",時間をかけて彼は珍しい本の大量のコレクションを蓄積することができました。,2995704
,,,adoption,"養子縁組 / 〈U〉(新しい方式などの)採用,採択; (外国語の)借用",/əˈdɒpʃən/,574,The adoption process can be long and complex.,養子縁組のプロセスは長くて複雑なことがあります。,1628841
,,,align,"【動/他】を一列に並べる, を整列する / 《...と》...を提携させる 《with ...》 /  《…と合うように》 ...を調整する《with, to ...》【動/自】 《...と》提携する《with ...》",/əˈlaɪn/,1080,Please align the pictures on the wall.,写真を壁に並べてください。,2995935
,,,allowance,"〈C〉認めること / 許容 / 容認 / 許容量 / 割り当て / (定期的な)手当,こづかい  / 割引き, 値引き",/əˈlaʊəns/,1159,The government has decided to increase the allowance for low-income families.,政府は低所得家庭への割り当てを増やすことを決定しました。,2995960
,,,alpha,"アルファ(ギリシア語アルファベットの第1字Α,α;英語のA,aに相当)  / アルファ星(星座の主星)",/'ælfə/,1196,The first letter of the Greek alphabet is alpha.,ギリシャ文字の最初の文字はアルファです。,1641851
,,,census,"〈C〉人口調査, 国勢調査",/'sɛnsəs/,6813,The government conducts a census every ten years to gather demographic information.,政府は10年ごとに国勢調査を実施して人口統計情報を収集します。,1628450
,,,array,"〈軍隊など〉'を'整列させる,配置する  / 《文》〈人〉‘に'衣類を着せる,(特に)〈人〉'を'盛装させる  / 〈U〉整列,陳列  / (…の)整列(配置)した物(人),勢ぞろい《+of+名(複数)》  / 〈U〉衣装,(特に)美しい装い",/əˈreɪ/,2240,I arrayed the books in the shelves.,本を棚に並べました。,1626322
,,,assertion,"〈C〉(しばしば根拠のない)断言,主張  / 〈U〉主張(断言)すること",/əˈsɜːrʃən/,2392,His assertion that he had never stolen anything was hard to believe.,彼が何も盗んだことがないという彼の断言は信じがたかった。,2996291
,,,atom,"原子  / 微量,非常な少量;《a~》微量,わずか(の…)《+of+名》",/ˈætəm/,2528,The atom is the basic unit of a chemical element.,原子は化学元素の基本単位です。,2996334
,,,attain,を達成する；に達する / 《...に》到達する《to》,/əˈteɪn/,2563,"With hard work and dedication, you can attain your goals.",努力と献身で、あなたは目標を達成することができます。,2996343
,,,auction,【名/C/U】競売 / 【動/他】〈物〉を競売にかける,/ˈɔːkʃən/,2621,I won the bid at the auction.,私はオークションで入札に勝ちました。,3008883
,,,automobile,《米》自動車  / 自動の;自動車の,/ˈɔː.tə.mə.biːl/,2749,I bought a new automobile yesterday.,私は昨日新しい自動車を買いました。,2996419
,,,aversion,"【名/U】《...に対する》嫌悪, 毛嫌い《to ...》 【名/C】大嫌いなもの",/əˈvɜːrʒən/,2787,He had an aversion to anything sweet.,彼は甘いものに対して嫌悪感を持っていた。,1626788
,,,basket,"かご,バスケット  / (…の)かご1杯(basketful)《+of+名》  / (バスケットボールで)ゴールの網  / 得点",/'bæskɪt/,3416,I put the apples in the basket.,私はリンゴをかごに入れました。,2996567
,,,bilateral,"相互の, 双方の / 左右相称の,両側のある / 双務的な, 相互に義務を負う",/baɪˈlætərəl/,4080,The two countries have a strong bilateral relationship.,2つの国は強い二国間関係を持っています。,1628887
,,,blend,(分離できないほどに)…'を'混ぜ合わせる;(…に)…'を'混ぜる《+名+with+名》  / 混じる;溶け合う  / (…と)調和する《+with+名》(harmonize),/blɛnd/,4381,The artist skillfully blends the colors to create a beautiful painting.,アーティストは色を巧みに混ぜ合わせて美しい絵を作り出します。,2996803
,,,bounce,"〈ボールなどが〉はずむ,はる返る  / 〈人が〉はねる  / …'を'はずませる,はる返らせる",/baʊns/,4931,The ball will bounce when it hits the ground.,ボールは地面に当たるとはずみます。,3008931
,,,brokerage,【名/U】仲買業；仲買手数料【C】仲介会社,/ˈbrəʊkərɪdʒ/,5328,I contacted a brokerage firm to help me invest in stocks.,私は株式投資のために証券会社に連絡しました。,1632190
,,,bureaucrat,【名/C】官僚・吏吏 / 官僚的な人,/bjʊəˈrɒkræt/,5617,The bureaucrat was responsible for handling the paperwork.,その官僚は書類の処理を担当していました。,3009117
,,,inflow,〈U〉流入  / 〈C〉流入物,/ˈɪnˌfloʊ/,21837,The inflow of tourists has significantly increased in recent years.,観光客の流入は近年、大幅に増加しています。,1649960
,,,cabinet,"キャビネット(引出し・たな・仕切などのある箱・戸だな)  / 《しばしばCabinet》《集合的に》《単数・複数扱い》内閣,(内閣の)閣僚連  / 《英》閣議  / 《古》小さい個室",/'kæbɪnət/,5853,The president appointed a new cabinet.,大統領は新しい閣僚を任命しました,3009175
,,,calendar,"〈C〉暦,カレンダー  / 〈C〉〈U〉暦法  / 〈U〉〈C〉年中行事表;訴訟事件表,議事日程表",/ˈkæl.ən.dər/,5965,I always mark important dates on my calendar.,私はいつも大切な日付をカレンダーに記入します。,3009193
,,,campus,"(大学などの)構内,キャンパス;学園  / 《米》(大学の)分校",/'kæmpəs/,6093,I love walking around the campus and exploring all the different buildings.,私はキャンパスを散策して、さまざまな建物を探検するのが好きです。,3009220
,,,capitalize,"【動/他】大文字にする,資本化する,投資する,資本価値を算出する",/ˈkæpɪtəˌlaɪz/,6266,Please remember to capitalize the first letter of each word.,各単語の最初の文字を大文字にすることを覚えてください。,3009246
,,,captain,"長,かしら(chief)  / 船長,艦長;(吾行機の)機長  / (チームの)主将,キャプテン;組長  / 陸軍大慰;海軍大佐;《米》(空軍・海兵隊の)大慰,《英》空軍大佐  /",/ˈkæp.tən/,6289,The captain of the ship is responsible for the safety of the crew and passengers.,船長は乗組員と乗客の安全を責任を持っています。,3009250
,,,carrier,"運搬する人;輸送業者(会社)  / 運搬する物,運客車;運客設備  / (…の)媒介体,保菌者《+of+名》  / (またaircraft carrier)航空母艦  / (自転車・車の)荷台",/ˈkæriər/,6463,The carrier transported the goods to the warehouse.,運搬人は商品を倉庫に運びました。,3009275
,,,certification,"〈U〉証明,保証,認可,検定;証明書の交付  / 〈C〉証明書(certificate)",/sɝː.tɪ.fɪˈkeɪ.ʃən/,6906,She received her certification as a yoga instructor.,彼女はヨガインストラクターの資格を取得しました。,1635750
,,,celebrity,"〈U〉名声,高名  / 〈C〉有名人,名士",/səˈlɛbrəti/,6769,"On encountering the celebrity, they asked for his autograph.",彼らは有名人と出くわすなり、サインをもとめた。,21828
,,,cease,"〈自〉止む,終わる / 〈他〉をやめる,を中止する",/sis/,6752,The fighting ceased after the peace treaty was signed.,平和条約が署名された後、戦闘は終了した。,3009373
,,,certificate,"〈C〉証明書,免許証(状),卒業証書",/sərˈtɪfɪkət/,6903,I received a certificate for completing the course.,私はコースを修了したことを証明するための証明書を受け取りました。,3009409
,,,chaos,"〈U〉(天地創造以前の)混とん  / 〈U〉(一般に)混乱状態,無秩序;〈C〉混乱したもの",/ˈkeɪ.ɒs/,7035,The world was in chaos before the creation of heaven and earth.,天地創造以前、世界は混とんとしていました。,3009337
,,,client,"[弁護]依頼人,訴訟依頼人  / (商売上の)おとくい(customer)",/'klaɪənt/,7862,The lawyer met with the client to discuss the case.,弁護士は依頼人と会って事件について話し合った。,3009538
,,,clinic,"〈U〉(医学の)臨床講義  / 〈C〉《集合的に》臨床講義のクラス  / 〈C〉臨床講義室  / 〈C〉(病院・医科大学・社会事業団などに付属した)診療所;《形容詞を判って》医療施設,病院  / 〈C〉(警察・学校・社会事業団などに付属した)相談所",/'klɪnɪk/,7888,I have an appointment at the clinic tomorrow.,明日、私はクリニックで予約があります。,1641756
,,,clue,"〈C〉(問題などを解く) 手がかり, 糸口 /",/kl(uː)/,8024,I found a clue that led me to the hidden treasure.,私は隠された宝物へと導く手がかりを見つけました。,2996979
,,,collectively,"集合的に, 集団で, 一丸となって / まとめると, 全体として",/kəˈlɛktɪvli/,8313,The team was able to achieve their goal because they worked collectively towards it.,チームが目標を達成できたのは、その目標に向かって一丸となって取り組んだからです。,1626011
,,,colonial,"植民地の, 植民の / 英国植民地(時代)の",/kəˈloʊnɪəl/,8357,The country gained independence from its colonial rulers.,その国は植民地支配者から独立を達成した。,1641309
,,,commissioner,"(政付が任命する)委員,理事  / (中央官庁・地方自治体の)長官,局長;弁務官  / 《米》(プロスポーツの)コミッショナー(運営の最高責任者で制裁権を持つ)",/kəˈmɪʃənər/,8531,The commissioner appointed a new committee.,政付が新しい委員会を任命しました。,1642156
,,,commentator,"注釈者  / (ラジオ・てレビの)解説者,実況放送者",/kɒmənˈteɪtər/,8511,The commentator provided insightful analysis during the live broadcast.,注釈者は生放送中に洞察力のある分析を提供しました。,3009667
,,,compel,【動/他】《...するように》〈人〉に強いる《to do》 / 《...に》...を強要する《from ...》,/kəmˈpɛl/,8641,The evidence was compelling enough to convince the jury of his guilt.,証拠は十分に説得力があり、陪審団を彼の有罪に納得させるには十分だった。,3009697
,,,comparable,【形1】比較可能な　【形2】匹敵する、相当する、同等な,/kəmˈpærəbəl/,8622,The performance of the new model is comparable to that of the previous version.,新しいモデルの性能は、前のバージョンと匹敵しています。,3009688
,,,competent,"有能な,能力のある;適任の / 満足のいく / 法的権限のある",/kɑmˈpɪtənt/,8652,She is a competent manager who can handle any task efficiently.,彼女はどんな仕事も効率的に処理できる有能なマネージャーです。,3009701
,,,compile,〈資料など〉をまとめる / 〈辞書など〉を編集する / 〈ソースコードなど〉を機械語に翻訳する,/kəmˈpaɪl/,8657,I need to compile all the data before the meeting.,会議前にすべてのデータをまとめる必要があります。,3009704
,,,compliance,"【名】《要求・命令などへの》承諾,応諾 《with ...》/ (企業などにおける)法令遵守 / 服従, 盲従",/kəmˈplaɪəns/,8685,Compliance with the rules is mandatory.,ルールに従うことは義務です。,3009713
,,,conjunction,"〈C〉接続詞(and,but,for,sinceなど)  / 《文》〈U〉〈C〉結合,連結;(事件などの)同時発生  / 〈U〉合(ごう)(二つ以上の天体が同じ黄経上にあること)",/kənˈdʒʌŋkʃən/,8996,"In English grammar, we use conjunctions to join sentences together.",英文法では、文をつなぎ合わせるために接続詞を使います。,3009795
,,,consent,"〈自〉《...に》同意する, 承諾する《to ...》 / 〈他〉に同意する",/kənˈsɛnt/,9049,He consented on the spot.,彼は即座に承知した。,28475
,,,conscious,"《補語にのみ用いて》気づいている,知っている,意識している  / 《補語にのみ用いて》(…に)反応を示す,意識(知覚)のある《+to+名》  / 《名詞の前にのみ用いて》意識した,わざとらしい  / 考えることができる,意志のある",/ˈkɒnʃəs/,9040,She is conscious of her surroundings.,彼女は周囲に気づいている。,3009799
,,,consolidation,"〈U〉強化すること, 強化されること / 〈U/C〉(会社・組織などの) 合併,合体,統合",/kənˌsɒlɪˈdeɪʃən/,9091,The consolidation of the company's assets will lead to increased efficiency.,会社の資産の統合は効率の向上につながります。,1628909
,,,constitution,"〈U〉(物の)構成,構造《+of+名》  / 〈C〉〈U〉体格,体質,性分質,気質  / 〈C〉政体  / 〈C〉憲法,国憲  / 《the C-》合衆国憲法  / 〈U〉(制度などの)制定…(機関なとの)設立",/kɒnstɪˈtjuːʃən/,9121,The constitution of this organization is well-structured.,この組織の構成はよく組み立てられています。,3009819
,,,constructive,"【形】建設的な, 前向きな / 構成の,構造上の",/kənˈstrʌktɪv/,9136,She provided constructive feedback on my project.,彼女は私のプロジェクトに建設的なフィードバックを提供しました。,3009831
,,,consumption,"〈U〉消費, 消耗, 使い果たすこと / 購入 / 消費量 / 摂取 /肺結核",/kənˈsʌmpʃən/,9157,The consumption of fast food has increased significantly in recent years.,最近、ファストフードの消費量が大幅に増加しています。,1628607
,,,corrective,"【形】訂正（調整,修正,矯正）する,正しくする；訂正（調整,修正,矯正）するための、矯正的な、調整的な　【名/C】《...に対する》修正《to》；矯正手段",/kəˈrɛktɪv/,9550,He received corrective feedback from his teacher.,彼は先生から訂正のフィードバックを受けました。,1633615
,,,corruption,"(官吏などの)不正行為,汚職  / 堕落  / (物の)腐敗  / (原文の)改悪;(言語の)なまり",/kəˈrʌpʃən/,9581,Corruption is a serious problem in many countries.,腐敗は多くの国で深刻な問題です。,2997044
,,,correspondent,"〈C〉特派員,通信員,記者 / 手紙を書く人 / 一致するもの /",/kɒrəˈspɒndənt/,9560,The correspondent reported live from the scene of the protest.,特派員は抗議の現場から生中継しました。,3009925
,,,coupon,"クーポン(切り取って使う切符)  / (広告・商品につく)景品引き換え券,優待券  / (公債の)利札(りふだ)",/ˈkuːpɑːn/,9776,I used a coupon to get a discount on my purchase.,私はクーポンを使って購入品の割引を受けました。,2997056
,,,coup,"〈C〉クーデター, 武力政変 / 大当たり, 大成功",/kʊp/,9767,The military staged a coup to overthrow the government.,軍事が政府を転覆させるためにクーデターを行った。,1628567
,,,unchanged,"変化のない,もとのままの",/ʌnˈtʃeɪndʒd/,44884,The weather remained unchanged throughout the day.,一日中天気は変わらなかった。,3006094
,,,decimal,小数の  / 十進法の  / 小数,/dɪˈsɛməl/,10990,The result of the calculation is a decimal number.,計算結果は小数になります。,2997359
,,,decree,"【名/C】法令, 布告 / (裁判所の)判決 ,命令 / 神意【動/他】を布告する / を命じる / を判決する【動/自】法令を定める",/dɪˈkriː/,11059,The king issued a decree to ban hunting in the forest.,王は森での狩猟を禁止する布告を出した。,2997377
,,,declaration,"〈U〉(…の)宣言,発表,布告《+of+名》  / 〈C〉申告書  / 〈C〉供述",/dɛkləˈreɪʃən/,11014,The president made a declaration about the new policy.,大統領は新しい政策について宣言をした。,2997375
,,,deduction,"〈U〉差し引き, 控除 / 〈C〉差し引き額, 控除額 / 〈U〉演繹法 / 〈U/C〉推論",/dɪˈdʌkʃən/,11073,The deduction for charitable donations is a great incentive for people to give to worthy causes.,慈善寄付に対する税控除は、人々が価値ある目的に寄付するための大きな動機となっている。,3010220
,,,decent,"(社会・道徳的な規範にかなって)きちんとした, ふさわしい, 妥当な / 《話》かなりよい / 《話》《be ~》親切な,寛大な/ かなりの",/'dɪsənt/,10974,He is a decent person who always follows social and moral norms.,彼はいつも社会的・道徳的な規範にかなって行動するきちんとした人物です。,2997365
,,,departure,"(…から)(遠くへ)立ち去ること,出発《+from+名》  / (通常のことから)はずれること,逸脱《+from+名》  / (方針・考えなどの)新機軸,新方針",/dɪˈpɑːtʃər/,11419,I watched my friends' departure as they left for a faraway land.,友達たちが遠い土地に向かって立ち去るのを見送った。,2997472
,,,depreciate,"…‘の'価値(価格)を下げる  / …‘を'見くびる,けなす  / 価値(価格)が下がる",/dɪˈpriːʃieɪt/,11462,The value of the car will depreciate over time.,車の価値は時間とともに下がります。,1654256
,,,depart,"《文》《…から》(遠くへ)立ち走る, 出発する《from ...》 / 《通常のことから》はずれる,変わる《from ...》",/dɪˈpɑːrt/,11412,My flight will depart in an hour.,私の飛行機はあと１時間で出発です。,77070
,,,deteriorate,"...を悪化させる / の品質などを低下させる / 悪化する,低下する",/dɪˈtɪəriəreɪt/,11626,The air quality in the city has been deteriorating due to increased pollution.,都市の空気の質は、増加した汚染によって悪化しています。,2997533
,,,diamond,〈C〉ダイヤモンド,/ˈdaɪəmənd/,11769,The diamond's brilliancy was breathtaking.,ダイヤモンドの輝きは息をのむほどだった。,1653109
