headword,pos,supplement,entry,meaning,ipa,word_id,example_sentence,translated_sentence,sentence_id
,,,recruitment,"〈U〉新規募集 / 新兵徴募, 新会員募集",/rɪˈkruːtmənt/,35180,Our company is currently recruiting new employees.,私たちの会社は現在、新しい社員を募集しています。,1645783
,,,transmit,"伝わる / を送る, を伝える",/trænzˈmɪt/,44036,The radio waves transmit information from one device to another.,無線波は情報を一つの機器から別の機器に伝えます。,3005917
,,,intrigue,【名/U】陰謀を企てること / 【名/C】陰謀 / 密通 / 【動/他】〈人〉の好奇心をそそる / 【動/自】〈...に対して》 陰謀を企てる 《against ...》,/ɪnˈtriːɡ/,22409,The mysterious letter filled her with intrigue.,その謎めいた手紙に、彼女は好奇心をそそられた。,3000342
,,,physics,〈U〉物理学,/fɪˈzɪksɪz/,31748,I studied physics in college.,私は大学で物理学を勉強しました。,3002752
,,,virtue,"〈U〉美徳,徳;高潔 / (特に婦人の)節操,貞操 / 〈C〉 (特定の)道徳,美徳 / 〈U/C〉《...という》 長所, 美点 《of ...》 / 《…するという》効力,ききめ《of ...》",/'vɜːrtʃuː/,46302,"1. Honesty is a virtue that should be valued.
2. What do you feel are the virtues of this company?","1. 正直は尊重されるべき美徳です。
2. この会社の良いところはどこだと思いますか？",3006474
,,,afterward,"あとで, あとに / 以後, その後",/ˈæftərwərd/,784,I will clean the house afterward.,私はあとで家を掃除します。,2995854
,,,commerce,"〈U〉《...との》 商業, 通商, 貿易 《with ...》",/ˈkɒmɜːs/,8512,E-commerce has revolutionized the way we shop.,Eコマースは私たちの買い物の仕方を革命化しました。,3009668
,,,withdrawal,"〈U〉引っ込めること,引っ込むこと / 《...から》退くこと,撤退《from ...》 / 《...から》 脱退 《from ...》 / (預金の)引き出し, 引き出し額 / 取り消し,撤回",/wɪðˈdrɔəl/,47651,The country announced a complete withdrawal of its troops from the region.,その国はその地域からの完全な軍隊の撤退を発表しました。,6535964
,,,cargo,"〈U〉(船・飛行機の) 積荷, 貨物",/'kɑːrɡoʊ/,6401,The cargo ship arrived at the port.,貨物船が港に到着しました。,3009269
,,,instinct,"〈U〉本能 / 〈C〉《…に対する》(生まれつきの)才能,素質,天分《for ...》",/ˈɪnstɪŋkt/,22110,Her instinct told her to trust him.,彼女の本能は彼を信じるように言った。,1628566
,,,memorandum,"〈C〉メモ,覚え書き / (会社内などの)連絡メモ,回覧 / (契約・取引きなどの条件の)要約,摘要書 / (会社の)定款",/mɛməˈrændəm/,26391,I need to write a memorandum for the meeting tomorrow.,明日の会議のためにメモを書かなければなりません。,1628456
,,,workshop,"〈C〉仕事場,工作場  /《米》(セミナー形式の)研究会,討論会",/'wɜːrkʃɒp/,47853,My father spends most of his time in his workshop.,私の父は彼の仕事場でほとんどの時間を過ごします。,1628618
,,,accusation,"〈C/U〉《...を》告発すること《of ...》, 告発されること / 〈C〉《...の》罪状, 罪《of ...》",/ˌæk.jʊ.ˈzeɪ.ʃən/,334,He made a false accusation against her.,彼は彼女に対して虚偽の告発をした。,1628605
,,,wheat,〈U〉小麦,/wiːt/,47176,Wheat is a staple crop in many countries.,小麦は多くの国で主要な作物です。,1628770
,,,distribution,"〈U〉《...への》配分, 配布《to ...》 / 〈C〉配分されたもの, 配給品 / 〈U〉（商品の）流通組織",/dɪstrɪˈbjuːʃən/,12406,The distribution of goods is an important aspect of the supply chain.,商品の流通はサプライチェーンの重要な側面です。,2997739
,,,obscure,【形容詞】不明瞭な、わかりにくい / 【動詞】を曖昧にする、を隠す,/əbˈskjʊr/,29199,The meaning of the poem was obscure.,詩の意味は不明瞭だった。,3002086
,,,destination,"〈C〉(旅行・航海などの) 目的地, 行き先 / (物の) 送付先, 到着地",/dɛstɪˈneɪʃən/,11592,What's the destination of this ship?,この船の目的地はどこですか。,132500
,,,threshold,"〈C〉敷居 / 《単数形で》《…の》始め, 出発点《of ...》 / しきい値",/ˈθɹɛʃ.hoʊld/,43231,The threshold for passing the exam is set at 70%.,試験の合格ラインは70％に設定されています。,1628890
,,,clout,"【名/C】《話》手でなぐること【名/U】《米話》政治的影響力,実力【動/他】 を手でなぐる",/klɑʊt/,8002,She used her clout to get the promotion.,彼女は昇進を得るために自分の影響力を使った。,1650339
,,,sterling,"【名/U】英貨, ポンド / 【形】英貨の, ポンドの / (銀が)法定純度の / (物の品質・人物など)本物の,真正の,確かな",/'stɜːrlɪŋ/,40957,He paid for the item with a sterling silver coin.,彼はその商品の代金を純銀貨で支払った。,1654702
,,,ballot,"〈C〉投票用紙 / 投票総数 / 〈U〉〈C〉無記命投票,(一般に)投票",/ˈbælət/,3157,I filled out my ballot for the upcoming election.,私は今後の選挙のために私の投票用紙を記入しました。,2996508
,,,unveil,"...を初公開する, のおおいをはずす / を明らかにする / の除幕(式)を行う / ベール（覆い）を脱ぐ / 正体を明らかにする",/ʌnˈveɪl/,45521,The company will unveil its new product next week.,会社は来週新製品を発表します。,1629080
,,,subsidiary,"【形】補助の / 従属的な / 補助金の / 【名/C】子会社 / 補助物(者), 付属物",/səbˈsɪdiˌɛri/,41544,The subsidiary company provides support to the main company.,子会社は親会社に支援を提供します。,3005239
,,,particle,"〈C〉粒子 / 小片,(ごく)少量,微量 / 不変化詞",/ˈpɑːrtɪkəl/,30733,The particle is very small.,その粒子はとても小さいです。,3002514
,,,syndicate,"【名/C】企業連合 / 通信社 / 【動/他】〈店・企業など〉を合同組織にする / (通信社を通して)〈記事・写真など〉を売る,を供給する / 【動/自】企業(店)を合同組織する",/sɪn.dɪ.kət/,42261,The syndicate is responsible for organizing illegal activities.,シンジケートは違法な活動を組織する責任があります。,1648299
,,,casualty,"〈C〉(事故・災害などの)死傷者, 負傷者, 被害者 / 不慮の事故,人身事故",/'kæʒuəlti/,6579,The casualty rate in the war was devastating.,戦争の死傷者率は壊滅的でした。,1628117
,,,proliferation,〈U〉《しばしばa~》《…の》拡散《of ...》 /  (細胞分裂による)増殖 / 【名/C】増殖部分,/prəˌlɪfəˈreɪʃən/,33597,The proliferation of technology has greatly impacted our daily lives.,技術の普及は私たちの日常生活に大きな影響を与えています。,1629365
,,,feedback,〈U〉フィードバック / 《話》《…についての》反応《about ...》,/ˈfiːdbæk/,15438,I appreciate your feedback on the project.,プロジェクトに対するフィードバックをいただけると幸いです。,2998548
,,,crunch,"【動/他】…をカリカリ(ボリボリ)かむ  / 〈砂利道・氷雪上など〉をバリバリ音を立てる,を音を立てて進む / 【動/自】をカリカリかむ / 【名/U/C】噛み砕くこと / 踏み砕くこと / 《the~》(決断が必要な)危機,緊張",/krʌntʃ/,10256,I love the sound of leaves crunching under my feet.,私は足元でカサカサと音を立てる葉の音が好きです。,2997176
,,,proposition,"〈C〉提案 / 陳述 / 命題 / 定理 / 《話》(扱わなければならない)仕事,事柄",/prəˈpɑzɪʃən/,33711,The proposition was met with strong opposition from the members.,その提案はメンバーから強い反対を受けました。,3003246
,,,scatter,をばらまく/ をまきちらす / を追い散らす,/'skætər/,37354,The wind scattered the leaves across the yard.,風が葉っぱを庭中に散らかした。,3004081
,,,disguise,〈他〉《...に》 ...を変装させる 《as ...》 / 《...だと》 ...を見せかける 《as ...》,/dɪsˈɡaɪz/,12178,The spy disguised himself as a waiter to gather information without being noticed.,スパイは目立たずに情報を収集するためにウェイターに変装しました。,2997685
,,,rebuild,"〈他〉を再建する,を作り直す / をたてなおす, 〈社会など〉を改革する",/ˌriːˈbɪld/,35029,"After the earthquake, the city had to rebuild its infrastructure.",地震後、市はインフラを再建する必要がありました。,1660252
,,,subsidize,...に補助金を与える / に奨励金を与える / …の協力を得る / …を買収する,/səbˈsaɪ.daɪz/,41547,The government decided to subsidize the new renewable energy project.,政府は新しい再生可能エネルギープロジェクトを補助することを決定しました。,1628485
,,,oblige,"〈人〉に義務を負わせる, に強制する / に親切にする, の願いを叶える",/əˈblaɪdʒ/,29180,I am obliged to help my friend move to a new apartment.,私は友人が新しいアパートに引っ越すのを手伝わなければならない義務があります。,3002091
,,,inventory,"〈C〉(商品・財産などの)目録 / 在庫品 / 〈U〉在庫品調べ / 【動/他】(財産・商品など) の目録を作る,の品調べをする",/ˈɪnvəntəri/,22454,I need to check the inventory before [[placing the order.]],注文する前に在庫を確認する必要があります。,1628210
,,,queue,〈C〉（順番を待っている人の）行列 / 順番を待つ人々,/kjuː/,34403,I waited in the queue for over an hour.,私は1時間以上列に並んで待ちました。,3003345
,,,rental,"〈C〉賃貸料,地代,家賃 / 〈U〉《...を》借りること, 貸すこと《of ...》 / 《米》賃貸するもの",/ˈrɛntəl/,35615,I need to return my rental car by tomorrow.,明日までにレンタカーを返さなければなりません。,1650439
,,,abolish,"〈他〉〈制度・習慣・規則など〉を廃止する,をやめる",/əˈbɑlɪʃ/,129,The government decided to abolish the old law.,政府は古い法律を廃止することを決定した。,2995621
,,,absorb,【動/他】を吸収する / 〈心・注意・時間〉をすっかり奪う,/əbˈsɔːrb/,197,Plants absorb sunlight to perform photosynthesis.,植物は光合成を行うために太陽光を吸収します。,2995643
,,,accurately,"【副】正確に,精密に",/ˈækjərətli/,330,He accurately described what happened there.,彼はそこで起きたことを正確に描写した。,38862
,,,acre,"エーカー(面積の単位;約4,047平方メートル)  / 《複数形で》田畑,土地",/ˈeɪkər/,403,The farm spans over fifty acres.,その農場は50エーカー以上に広がっています。,2995729
,,,adhere,粘着する/固執する/守る,/ədˈhɪər/,507,It is important to adhere to the rules and regulations.,規則と規制を守ることが重要です。,2995371
,,,administer,"…'を'治める,管理運営する  / (…に対して)…'を'執行する,実行する(carry out)《+名+to+名》  / (…に)〈薬・手当て・援助など〉'を'与える《+名+to+名》  / (…に)〈一撃・非難・叱責など〉'を'与える,浴びせる《+名+to+名》  / (…に)寄与する,役立つ《+to+名》",/ədˈmɪnəstər/,541,The mayor will administer the city for the next four years.,市長は次の4年間、この都市を治めます。,2995774
,,,admission,"〈U〉《場所・学校・会などへ》入ることを許すこと《to ...》 / 《...への》 入場料 《to ...》 / 〈C〉(事実・誤りなどを)認めること,白状",/ədˈmɪʃən/,556,The museum offers free admission to students on weekends.,週末には、学生は無料でその博物館に入場できる。,2995787
,,,affiliate,"【動/他】《規模がさらに大きいグループに》 を加入させる, を提携させる《with, to ...》 / 【動/自】《...に》 加入する《to ...》 / 《...と》 合併する, 提携する 《with ...》 / 【名/C】加入者, 会員 / 支部",/əˈfɪli.eɪt/,717,We decided to affiliate our company with the international organization to expand our business.,私たちはビジネスを拡大するために、私たちの会社を国際組織に加盟させることにしました。,2995828
,,,aggregate,"【動/他】を集める / 【動/自】総計《....に》なる 《to ...》 / 【形】集まった / 総計の / 【名/U】集合体 / 【名/U/C】(砂利など)骨材  / 《the ~》総計,総額",/ˈæɡrɪɡət/,824,The company will aggregate data from various sources to analyze customer behavior.,会社は顧客の行動を分析するために、さまざまな情報源からデータを集約します。,1665192
,,,alike,似ている；同様である,/əˈlaɪk/,1084,"Despite their differences, the two paintings are very much alike.",それらの違いにもかかわらず、その2つの絵は非常に似ています。,2995937
,,,ambition,"大望,野心,野望  / 〈C〉大望(野心)の対象(目的)",/æmˈbɪʃən/,1292,His ambition to become a successful entrepreneur is truly inspiring.,彼が成功した起業家になるという大望は本当に感動的です。,2996010
,,,ambitious,"大望を抱いた,野心のある,大志を抱いた  / (仕事・計画などが)野心的な,大がかりな;(悪い意味で)大げさな,高望みの",/æmˈbɪʃəs/,1293,He was ambitious of success in business.,彼は実業家として成功したいと熱望していた。,30412
,,,aluminum,〈U〉《米》アルミニウム,/əˈluːmɪnəm/,1245,The soda can is made of aluminum.,そのソーダ缶はアルミニウムでできています。,2995990
,,,amid,…の中に / …のまっさい中に / （=[[mid]]）,/əˈmɪd/,1345,She found her peace amid the chaos.,彼女は混乱の中に平和を見つけました。,2996022
,,,amongst,～の間に / ～の中の,/əˈmʌŋst/,1371,The truth is often found hidden amongst the lies.,真実はしばしば嘘の間に隠されて見つかるものです。,2996029
,,,analytic,"【形】分析的な,分解的な,解析的",/ænə'lɪtɪk/,1448,She has a very analytic mind.,彼女は非常に分析的な考え方を持っています。,1651590
,,,appetite,"〈U〉食欲 / 〈C〉《...に対する》欲求, 切望《for ...》",/ˈæpəˌtaɪt/,1926,My appetite has decreased significantly since I started this new diet.,この新しいダイエットを始めてから、私の食欲は大幅に減少しました。,2996159
,,,architect,"建築家,建築技師  / (特に長期にわたる作業計画・事業などの)創始者,創案者,計画者",/ˈɑːrkɪtɛkt/,2106,My brother is studying to become an architect.,私の兄は建築家になるために勉強しています。,2996203
,,,assault,"〈U〉〈C〉《...を》襲うこと, 攻撃 《against, on ...》 / 《法》暴行",/əˈsɔːlt/,2380,The police are investigating the assault that happened last night.,警察は昨夜発生した暴行事件を調査しています。,2996287
,,,assignment,割り当てられた仕事,/əˈsaɪnmənt/,2404,When will your assignment be completed?,君の宿題はいつ終わりますか。,92217
,,,auto,《米話》=automobile,/ˈɔːtoʊ/,2716,I need to get my auto serviced this weekend.,今週末、私の自動車のメンテナンスをしなければなりません。,2996397
,,,axis,"〈C〉軸,軸線;枢軸(すうじく)  / 《the A-》枢軸国(第二次大戦当時の日本・ドイツ・イタリアなど)",/ˈæksɪs/,2850,The earth rotates on its axis.,地球はその軸上で回転します。,2996404
,,,backward,後方へ / 逆に,/bækwərd/,3021,He took a step backward when he saw the snake.,彼は蛇を見て後方へ一歩下がった。,2996468
,,,bankrupt,破産した / 欠いた,/'bæŋk.rʌpt/,3243,The company went bankrupt.,その会社は破産した。,123579
,,,baseline,基線  / (テニスコートの)ベースライン  / (野球の)ベースライン,/ˈbeɪsˌlaɪn/,3399,The baseline data is essential for the research.,基線データは、その研究にとって不可欠です。,2996562
,,,beam,"〈C〉(建設の)はり,けた,横材  / 〈C〉(船の甲板を支える)横はり  / 〈C〉(はかりの)さお;(織機の)糸巻き  / 〈C〉光線,光束  / 〈C〉(顔などの)輝き,晴れやかさ  / 〈C〉(船舶・航空機用の)信号電波  / 〈U〉最大船幅",/biːm/,3563,The construction worker is installing the beam in the new building.,建設作業員が新しい建物にはりを取り付けています。,2996600
,,,beef,"〈U〉牛肉;(一般に)肉  / 〈C〉《おもに米》肉牛,食肉牛;(屠殺(とさつ)して処理した)牛  / 〈U〉《話》筋肉,力;体重,肉づき  / 〈C〉《俗》不平,苦情",/biːf/,3674,I love eating beef.,私は牛肉を食べるのが大好きです。,1623490
,,,behavioral,【形】行動の,/bɪˈheɪvjərəl/,3740,His behavioral problems are causing issues at school.,彼の行動上の問題が学校で問題を引き起こしています。,1641168
,,,bitter,"苦い  / つらい　苦しい,きびしい,悲痛な  / (寒気などが)きびしい  / 敵意に満ちた,恨みに思っている  / 冷酷な;しんらつな;彼肉な  / ひどく(bitterly)",/ˈbɪtər/,4232,This coffee is too bitter.,このコーヒーはにがすぎます。,135517
,,,born,"【形】生まれながらの,先天的な；生まれた；生じた",/bɔrn/,4860,She was born in a small town.,彼女は小さな町で生まれました。,3008916
,,,blank,"(紙が)白紙の;(欄が)空白の,書き入れていない  / がらんとした,からの(empty);なんの装飾もない  / ぼんやりした,うつろな,無関心な  / 全くの  / 空白,空所  / 書き込み用紙(form)  / 空虚;空(くう)の部分  / (語句・文学を伏せる場所に用いる)ダッシュ“‐"":Mr-某氏  / (またblank cartridge)(銑火器の)空包",/blæŋk/,4335,The sky was blank and empty.,空は空しく、何もない状態だった。,1624005
,,,bonus,"ボーナス,特別手当;特別配当金  / 桂品,おまけ  / 《話》思いがけない喜び[を与えるもの]",/'boʊnəs/,4757,I received a bonus for my hard work.,私は頑張った成果としてボーナスを受け取りました。,1641067
,,,bound,"【動/自】跳ね上がる, 跳ね返る / 〈心が〉おどる,わくわくする  / 【名/C】はずみ,はね返り / 跳躍",/baʊnd/,4935,The dog is bound by a leash.,犬はリードで繋がれています。,3008937
,,,bound,"【名/C】《複数形で》《…の》境界,境界線《of ...》 / 《複数形で》《…の》 限度,限界《of ...》 / 【動/他】《通例受動態で》〈国など〉と境を設する / 〈行動・欲望など〉を制限する",/baʊnd/,4936,The hiker reached the bound of the national park.,ハイカーは国立公園の境界線に到達しました。,3010191
,,,brave,勇敢な、重いきった / 派手な、目立つ／,/breɪv/,5100,She showed a brave face despite her fear.,彼女は恐怖にもかかわらず勇敢な顔を見せた。,3008975
,,,brick,〈C〉(1個の)れんが  / 〈U〉(材料としての)れんが  / 〈C〉(形が)れんがに似た物,/brɪk/,5199,He built a house using bricks.,彼はれんがを使って家を建てました。,3009011
,,,broadband,(周波数が)広帯域の,/ˈbrɔːdbænd/,5295,I have a broadband internet connection at home.,私は家で広帯域のインターネット接続を使っています。,1660250
,,,broker,"【名/C】仲介者 / 【動/他】(契約など) を取り決める, を仲介する / 【動/自】ブローカーとして働く",/'broʊkər/,5327,I hired a broker to help me buy a house.,私は仲介業者を雇って家を買うのを手伝ってもらいました。,3009038
,,,bubble,"〈C〉あわ,あぶく  / 〈U〉あわ立ち,あわ立ちの音  / 〈C〉(すぐ消える)あわのようなこと  / 〈C〉シャボン玉",/ˈbʌbəl/,5424,The children are blowing bubbles.,子供たちがシャボン玉を吹いている。,82916
,,,buffer,"【名/C】（衝突の衝撃を弱める）緩衝器  / 間に立って争いや衝突の働撃を弱める人(物) , 和らげるもの / 物をみがく人(道具)  / 【動/他】…'を'緩和する,を和らげる / …を緩衝液で処理する",/ˈbʌfər/,5477,I need to use a buffer to smooth out the rough edges of the wood.,木材のザラザラした部分を滑らかにするためにバッファを使う必要があります。,3009079
,,,bureaucracy,"〈U/C〉官僚政治,官僚制度；《the ~》官吏,官僚；お役所式の繁雑な手続",/bjuːˈrɒkrəsi/,5616,The bureaucracy in this government is incredibly inefficient.,この政府の官僚制度は非常に効率が悪いです。,1628889
,,,calculation,"〈U〉〈C〉計算,見積もり,算定；予想,推定；意図,熟慮",/kæl.kjuˈleɪ.ʃən/,5956,I need to do some calculation for this project.,このプロジェクトのために計算をしなければなりません。,3009190
,,,centralize,"【動/他】中心に集める,中央集権化する",/sɛntrəlaɪz/,6861,The company decided to centralize its operations in one location.,会社はオペレーションを一箇所に集約することを決定しました。,1651610
,,,certify,を証明する / を保証する / を確認する,/sərˈtɪfaɪ/,6913,The document needs to be certified before it can be submitted.,書類は提出する前に証明される必要があります。,3009411
,,,click,"(掛け金をかけたり,錠を回したりする時の)カチリという音  / カチリと鳴る物;掛け金",/klɪk/,7860,"If you enjoyed this, please give a click on the vote link!",お楽しみいただけましたら、ポチっと１票お願いいたします！,986
,,,cognitive,【形】認知の,/kɑˈɡnɪtɪv/,8214,Cognitive abilities decline with age.,年齢とともに認知能力は低下する。,1659917
,,,collar,"(衣服の)えり, えり首 / (犬などの)首輪",/'kɑlər/,8294,She adjusted her collar before leaving the house.,彼女は家を出る前にえりを整えた。,3009617
,,,commodity,"【名/C】日用品, 商品 / 《かたく》 役に立つ物, 便利な物",/kəˈmɑːdəti/,8540,The price of the commodity has increased due to high demand.,需要の高まりにより、商品の価格が上昇しました。,2996994
,,,comparative,"比較の,比較による  / 比較的,かなりの  / 比較級の  / 比較級",/kəmˈpær.ə.tɪv/,8624,She is taller than her sister.,彼女は妹よりも背が高いです。,3009690
,,,compensate,《…に対して》〈人〉に補償する《for ...》 / 〈損失など〉を償う / 《米》…に報酬(給与)を支払う / 《損失などを》償う《for ...》,/kɑm.pənˌseɪt/,8645,The company will compensate the employees for their overtime work.,会社は従業員に残業代を補償します。,3009696
,,,conference,"〈C〉会議,協議会  / 〈U〉〈C〉(…との)相談,協議《+with+名》  / 〈C〉(学校,スポーツクラブなどの)連盟",/ˈkɑnfərəns/,8890,I attended a conference last week.,先週、私は会議に出席しました。,3009773
,,,confer,"【動/自】《...と》相談する《with ...》 / 《...について》相談する,協議する《about, on ...》【動/他】《...に》 (爵位・勲章・恩恵など)を与える, を授ける《on, upon ...》",/'kɑnfɜr/,8889,They confer with each other before making a decision.,彼らは決定をする前に相談する。,3009772
,,,confine,"《ある範囲に》…を制限する, 限る(limit)《to ...》  / 《…に》〈人など〉を閉じ込める, 監禁する《in, to ...》  / 《通例受動熊で》〈女性〉をお産の床につかせる",/kənˈfaɪn/,8910,The study will confine its focus on children under 10 years old.,その研究は10歳未満の子供に焦点を限定する。,2995450
,,,conform,"【動/自】従う【動/他】を従わせる, 適合させる; 一致させる",/kənˈfɔrm/,8926,It is important to conform to the rules and regulations of the company.,会社の規則や規制に従うことが重要です。,2997009
,,,confront,"〈他〉に立ち向かう,ぶつかっていく； の前に立ちはだかる,に向かい合って立つ； 《AとB》を直面させる, 対決させる《A with B》",/kənˈfrʌnt/,8936,I had to confront my fears in order to overcome them.,私はそれらを克服するために恐怖に立ち向かわなければならなかった。,3009781
,,,confirmation,"(陳述・所信などの)確認;(情報などの)確証;(条約などの)承認《+of+名》;(…であるという)確証,確認《+that節》  / 堅信礼(幼年時代に洗礼を受けた人が成人してその信仰を堅めるために告白をして教会員となる儀式)",/kɑːn.fərˈmeɪ.ʃən/,8913,I need confirmation that the package has been delivered.,私は荷物が配達されたことを確認する必要があります。,1642170
,,,contend,"...であると強く主張する / 《...のことで...と》争う, 論争する《against, with ... for, about ...》",/kənˈtɛnd/,9187,I contend that education is the key to success.,私は教育が成功の鍵であると強く主張する。,3009849
